FECHA,IMPORTANCIA,TAREA,ULTIMO ACCION
2026-01-14,Alta,MONITOREAR PAQUETE DE MUESTRAS DE COLOMBIA,FEDEX RECOGIO EL PAQUETE EL DIA 14/01/2026
2026-01-15,Alta,GLZ02779503  232858 1750888 FLAMINGOS  SE MANDA DE NUEVO CON 3G,SE MANDO SEGUNDO PEDIDO
2026-01-15,Baja,GLZ02779497  232920  1750954  CITY  SE MANDO DE NUEVO CON 3G,SE MANDO SEGUNDO PEDIDO
2026-01-19,Baja,GUIA SIN ENTREGAR DE FEDEX DETENIA EN CDMX C-221978613.,COMENZO INVESTIGACION 19/01/2026
2026-01-20,Baja,ENVIO FEDEX ALE GOMEZ - GRUPO POSADAS,ENVIADA POR FEDEX
